{
  "$schema": "https://json-schema.org/draft/2020-12/schema",
  "$id": "https://raw.githubusercontent.com/adaliontech/Zaibatsu/v1.9.0/schemas/factory-runtime-evidence.schema.json",
  "title": "Zaibatsu signed factory runtime evidence set",
  "type": "object",
  "additionalProperties": false,
  "required": ["contract_schema", "schema_version", "factory", "source", "qualification_scope", "receipts", "summary", "evidence_boundary", "runtime_evidence_set_sha256"],
  "properties": {
    "contract_schema": {"const": "https://raw.githubusercontent.com/adaliontech/Zaibatsu/v1.9.0/schemas/factory-runtime-evidence.schema.json"},
    "schema_version": {"const": "zaibatsu.factory-runtime-evidence.v1"},
    "factory": {"$ref": "#/$defs/factory"},
    "source": {"$ref": "#/$defs/source"},
    "qualification_scope": {"$ref": "#/$defs/scope"},
    "receipts": {
      "type": "array",
      "minItems": 1,
      "maxItems": 256,
      "uniqueItems": true,
      "items": {"$ref": "#/$defs/receipt"}
    },
    "summary": {
      "type": "object",
      "additionalProperties": false,
      "required": ["receipt_count", "unique_bindings", "signature_count", "qualification_scope"],
      "properties": {
        "receipt_count": {"type": "integer", "minimum": 1, "maximum": 256},
        "unique_bindings": {"type": "integer", "minimum": 1, "maximum": 256},
        "signature_count": {"type": "integer", "minimum": 0, "maximum": 256},
        "qualification_scope": {"$ref": "#/$defs/scope"}
      }
    },
    "evidence_boundary": {
      "type": "object",
      "additionalProperties": false,
      "required": ["externally_supplied", "trusted_key_registry_required", "verifier_registry_selected_externally", "verifier_key_ownership_verified", "verifier_independence_verified", "requires_signature_verification", "verifier_assertions_reexecuted", "evidence_artifacts_embedded", "self_attestation_accepted", "signature_grants_runtime_eligibility", "activation_authorized", "execution_authorized"],
      "properties": {
        "externally_supplied": {"const": true},
        "trusted_key_registry_required": {"const": true},
        "verifier_registry_selected_externally": {"const": true},
        "verifier_key_ownership_verified": {"const": false},
        "verifier_independence_verified": {"const": false},
        "requires_signature_verification": {"const": true},
        "verifier_assertions_reexecuted": {"const": false},
        "evidence_artifacts_embedded": {"const": false},
        "self_attestation_accepted": {"const": false},
        "signature_grants_runtime_eligibility": {"const": false},
        "activation_authorized": {"const": false},
        "execution_authorized": {"const": false}
      }
    },
    "runtime_evidence_set_sha256": {"$ref": "#/$defs/sha256"}
  },
  "$defs": {
    "sha256": {"type": "string", "pattern": "^[0-9a-f]{64}$"},
    "slug": {"type": "string", "pattern": "^[a-z0-9]+(?:-[a-z0-9]+)*$"},
    "requirement": {"type": "string", "pattern": "^[a-z][a-z0-9]*(?:_[a-z0-9]+)*$"},
    "timestamp": {"type": "string", "pattern": "^\\d{4}-\\d{2}-\\d{2}T\\d{2}:\\d{2}:\\d{2}Z$"},
    "scope": {"enum": ["factory_runtime", "public_test_fixture"]},
    "factory": {
      "type": "object",
      "additionalProperties": false,
      "required": ["id", "class"],
      "properties": {
        "id": {"$ref": "#/$defs/slug"},
        "class": {"enum": ["control_factory", "economic_factory"]}
      }
    },
    "source": {
      "type": "object",
      "additionalProperties": false,
      "required": ["bundle_sha256", "qualification_plan_sha256", "qualification_policy_id", "qualification_policy_sha256", "verifier_registry_sha256", "module_api_version"],
      "properties": {
        "bundle_sha256": {"$ref": "#/$defs/sha256"},
        "qualification_plan_sha256": {"$ref": "#/$defs/sha256"},
        "qualification_policy_id": {"$ref": "#/$defs/slug"},
        "qualification_policy_sha256": {"$ref": "#/$defs/sha256"},
        "verifier_registry_sha256": {"$ref": "#/$defs/sha256"},
        "module_api_version": {"const": "zaibatsu.module.v1"}
      }
    },
    "receipt": {
      "type": "object",
      "additionalProperties": false,
      "required": ["payload", "payload_sha256", "signature"],
      "properties": {
        "payload": {"$ref": "#/$defs/payload"},
        "payload_sha256": {"$ref": "#/$defs/sha256"},
        "signature": {"$ref": "#/$defs/signature"}
      }
    },
    "payload": {
      "type": "object",
      "additionalProperties": false,
      "required": ["factory_id", "bundle_sha256", "qualification_plan_sha256", "qualification_policy_sha256", "verifier_registry_sha256", "position", "slot", "module", "artifact_sha256", "requirement", "qualification_scope", "evidence_artifact_sha256", "verifier_id", "verification_method", "verifier_implementation_sha256", "observed_at", "valid_until", "result", "self_attested", "grants_activation", "grants_execution"],
      "properties": {
        "factory_id": {"$ref": "#/$defs/slug"},
        "bundle_sha256": {"$ref": "#/$defs/sha256"},
        "qualification_plan_sha256": {"$ref": "#/$defs/sha256"},
        "qualification_policy_sha256": {"$ref": "#/$defs/sha256"},
        "verifier_registry_sha256": {"$ref": "#/$defs/sha256"},
        "position": {"type": "integer", "minimum": 0, "maximum": 8},
        "slot": {"enum": ["source_versioning", "static_secrets", "runtime_secrets", "host_reproduction", "worker_environment", "scheduling", "execution", "verification", "feedback"]},
        "module": {"$ref": "#/$defs/slug"},
        "artifact_sha256": {"$ref": "#/$defs/sha256"},
        "requirement": {"$ref": "#/$defs/requirement"},
        "qualification_scope": {"$ref": "#/$defs/scope"},
        "evidence_artifact_sha256": {"$ref": "#/$defs/sha256"},
        "verifier_id": {"$ref": "#/$defs/slug"},
        "verification_method": {"$ref": "#/$defs/requirement"},
        "verifier_implementation_sha256": {"$ref": "#/$defs/sha256"},
        "observed_at": {"$ref": "#/$defs/timestamp"},
        "valid_until": {"$ref": "#/$defs/timestamp"},
        "result": {"const": "passed"},
        "self_attested": {"const": false},
        "grants_activation": {"const": false},
        "grants_execution": {"const": false}
      }
    },
    "signature": {
      "type": "object",
      "additionalProperties": false,
      "required": ["algorithm", "namespace", "value_base64"],
      "properties": {
        "algorithm": {"const": "ssh-ed25519"},
        "namespace": {"const": "zaibatsu-runtime-evidence-v1"},
        "value_base64": {"type": "string", "minLength": 1, "maxLength": 16384, "pattern": "^[A-Za-z0-9+/]+={0,2}$"}
      }
    }
  }
}
